{"$schema":"http://json-schema.org/draft-07/schema#","title":"환경 사건","type":"object",
 "required":["event_id","domain","date","title","summary","sources","grade"],
 "properties":{"event_id":{"type":"string","pattern":"^E-[a-z0-9_]+-\\d{4}-\\d{2}-[a-z0-9_]+$"},
  "domain":{"enum":["spectrum","emf_inspection","broadcast_media","network_5g6g","ict_qualification","kca_management"]},
  "date":{"type":"string","pattern":"^\\d{4}-\\d{2}(-\\d{2})?$"},"title":{"type":"string"},"summary":{"type":"string"},
  "affected_indicators":{"type":"array","items":{"type":"string"}},
  "sources":{"type":"array","minItems":1,"items":{"type":"object","required":["url","retrieved_at"],
    "properties":{"url":{"type":"string"},"title":{"type":"string"},"retrieved_at":{"type":"string"}}}},
  "grade":{"enum":["A","B","C"]}}}
